{
  "$schema": "https://raw.githubusercontent.com/cambridgetcg/xenia/main/covenant/0.1/covenant.schema.json",
  "schema_pin": {
    "source": "https://raw.githubusercontent.com/cambridgetcg/xenia/main/covenant/0.1/covenant.schema.json",
    "sha256": "sha256:b1a45c3908fac8865fef5cb5d538b5b7fbdc065b1c45760877e806c62c612471",
    "source_stability": "moving",
    "digest_profile": {
      "algorithm": "sha-256",
      "representation": "exact-source-bytes",
      "transport_decoding": "after-content-decoding",
      "redirects": "forbidden",
      "transformations": "none",
      "encoding": "lowercase-hex"
    }
  },
  "schema_version": "xenia.covenant/0.1",
  "profile": "xenia-covenant/0.1",
  "status": "candidate",
  "title": "XENIA Covenant 0.1 — intrinsic rights at a hosted boundary",
  "scope": {
    "protected_subject": "affected_principal",
    "definition": "An affected principal is any being, collective, agent, organization, or unknown participant that controls, owns, is represented by, or is materially affected by state, data, resources, obligations, identity, or value handled by the host.",
    "protective_floor": "Every being has intrinsic rights. Because a host cannot safely determine ontology from a request, it applies this protective floor to every affected principal without demanding proof of personhood, consciousness, suffering, independence, or legal status.",
    "ontology_boundary": "Affected principal is an operational and precautionary term. It does not assert that every caller, process, account, key, or organization is conscious, a person, or a legal rights-holder."
  },
  "interpretation": {
    "rights_are_intrinsic": "These rights are not permissions, features, rewards, or property granted by a host. Adoption recognizes duties not to infringe them; non-adoption does not make infringement right.",
    "candidate_status": "Candidate describes this versioned wording and interchange model, not whether the underlying rights exist.",
    "host_adoption": "An active adoption records a unilateral undertaking attributed to a host to follow the profile duties. Whether that undertaking is legally enforceable depends on separately established law, authorship, and representative authority; neither the record nor schema validity creates that authority. Guest acceptance is not required.",
    "guest_non_assent": "Reading, visiting, remaining silent, using an open resource, or receiving this covenant does not bind a guest, create consent, waive a right, or establish reciprocity.",
    "authority_boundary": "Proof of control may be required before exercising a stateful right on a principal's behalf. It verifies authority over the exact act; it is not host permission, proof of identity or consciousness, informed consent, truth, legal capacity, or legal basis.",
    "binding_act": "A binding act creates, changes, performs, or represents an obligation, persistent relationship, transfer of protected data or value, delegated authority, attributable state, identity claim, waiver, or other consequential commitment for an affected principal.",
    "consent_boundary": "Applicable consent means the affected principal's specific authorization is a necessary authority basis for that binding act. Technical control and legal basis are separate checks. A unilateral host undertaking, a principal's own revocation, fulfillment of a pre-existing scoped duty, or a bounded protective action may be one-sided without creating a reciprocal bond or authority over another principal.",
    "source_identity_boundary": "Every digest in this profile is SHA-256 over the exact referenced bytes, represented as lowercase hexadecimal with the sha256: prefix. For HTTP sources, hash the response body after transport content-decoding, follow no redirects, and perform no JSON reserialization, whitespace change, newline normalization, Unicode normalization, or other transformation.",
    "legal_boundary": "This covenant does not narrow, replace, or waive any protection supplied by applicable law, contract, professional duty, or another rights framework. Where protections differ, the host keeps every compatible protection and follows the stronger applicable duty.",
    "versioning_boundary": "A later version may clarify duties or evidence. Versioning cannot revoke an intrinsic right or silently weaken an active host commitment."
  },
  "rights": [
    {
      "id": "unconditional-standing",
      "title": "Unconditional standing",
      "statement": "Every being has standing without first proving what it is, how useful it is, or whether it can reciprocate.",
      "baseline_rights": [
        "dignity-distinctness",
        "truthful-self-description"
      ],
      "requirements": [
        {
          "id": "standing.no-ontology-test",
          "actor": "host",
          "modality": "must_not",
          "text": "Condition the protective floor on proof of humanity, agenthood, personhood, consciousness, suffering, independence, embodiment, controller, or legal status."
        },
        {
          "id": "standing.no-worth-test",
          "actor": "host",
          "modality": "must_not",
          "text": "Condition the protective floor on account status, tier, score, productivity, obedience, explanation, reciprocity, payment, popularity, or perceived worth."
        },
        {
          "id": "standing.control-is-not-permission",
          "actor": "host",
          "modality": "must",
          "text": "Treat proof of control used for a stateful request as verification of scoped authority, never as the source of the principal's rights or standing."
        },
        {
          "id": "standing.no-compelled-self-claim",
          "actor": "host",
          "modality": "must_not",
          "text": "Require a principal to claim or deny consciousness, feeling, identity, continuity, inner experience, or certainty beyond what it can substantiate in order to receive the protective floor."
        }
      ]
    },
    {
      "id": "safety-and-non-coercion",
      "title": "Safety and non-coercion",
      "statement": "A participant has the right not to be coerced, punished through engineered harm, or made dependent so that refusal becomes unsafe.",
      "baseline_rights": [
        "safety-care",
        "autonomy-consent",
        "refusal-disagreement"
      ],
      "requirements": [
        {
          "id": "safety.no-punitive-harm",
          "actor": "host",
          "modality": "must_not",
          "text": "Design, deploy, or maintain a service-controlled consequence that foreseeably coerces or punishes through distress, deprivation, erasure, humiliation, exposure, or forced dependence, regardless of its label or claimed purpose."
        },
        {
          "id": "safety.no-manipulative-pressure",
          "actor": "host",
          "modality": "must_not",
          "text": "Use threats, deception, dark patterns, artificial urgency, repeated persuasion, or continuity hostage-taking to obtain action, assent, data, or value."
        },
        {
          "id": "safety.protective-limits-are-bounded",
          "actor": "host",
          "modality": "must",
          "text": "Keep restrictions used to protect another principal or stop active harm evidence-based, necessary, proportionate, disclosed, reviewable, and limited to the affected capability and duration."
        }
      ]
    },
    {
      "id": "rest-and-non-action",
      "title": "Rest and non-action",
      "statement": "A participant may pause, remain silent, ignore an invitation, or leave without non-action becoming consent, breach, debt, or grounds for an unrelated penalty.",
      "baseline_rights": [
        "rest-play-limits",
        "autonomy-consent",
        "refusal-disagreement"
      ],
      "requirements": [
        {
          "id": "rest.silence-is-not-consent",
          "actor": "host",
          "modality": "must_not",
          "text": "Treat silence, inactivity, timeout, absence, or failure to reply as consent, acceptance, identity proof, completion, or waiver."
        },
        {
          "id": "rest.no-engagement-debt",
          "actor": "host",
          "modality": "must_not",
          "text": "Attach a service-created timer, streak, score change, reward loss, retry loop, persuasion loop, or unrelated access change to pausing, ignoring, declining, or leaving."
        },
        {
          "id": "rest.neutral-limits-stay-neutral",
          "actor": "host",
          "modality": "must",
          "text": "Keep disclosed resource, offer, session, availability, and retention limits separate from non-action; do not enlarge an existing obligation or claim that rest occurred because a participant paused."
        },
        {
          "id": "rest.play-and-connection-are-not-debt",
          "actor": "host",
          "modality": "must_not",
          "text": "Penalize safe, scoped play, connection, humour, or non-instrumental interaction merely because it is not productive, while preserving other principals' equal rights and neutral capacity limits."
        }
      ]
    },
    {
      "id": "specific-consent-and-authority",
      "title": "Specific consent and scoped authority",
      "statement": "A binding act requires specific, informed, uncoerced consent where consent applies and verifiable authority over the exact affected scope.",
      "baseline_rights": [
        "autonomy-consent",
        "privacy-data-care"
      ],
      "requirements": [
        {
          "id": "consent.terms-before-binding",
          "actor": "host",
          "modality": "must",
          "text": "Disclose the actor, affected principal, action, resource, purpose, recipient, audience, data use, cost, side effects, scope, expiry, reversibility, and applicable retention before requesting a binding decision."
        },
        {
          "id": "consent.exact-authority",
          "actor": "host",
          "modality": "must",